{
  "slug": "studio-demo-x7k2",
  "companyName": "Studio Demo",
  "sector": "Servizi professionali",
  "city": "Roma",
  "website": "https://example.com",
  "template": "professional",
  "theme": {
    "accent": "#7347e8",
    "accentSecondary": "#ea5d8f",
    "background": "#08080b"
  },
  "hero": {
    "eyebrow": "Servizi professionali · Roma",
    "title": "Più chiarezza. Più fiducia. Più richieste.",
    "description": "Una proposta digitale costruita per spiegare subito il valore dello studio, rendere i servizi semplici da comprendere e accompagnare il visitatore verso un contatto reale."
  },
  "problems": [
    "Il valore dei servizi non emerge con sufficiente immediatezza.",
    "Il percorso mobile richiede troppi passaggi prima del contatto.",
    "Mancano prove e contenuti che rafforzino fiducia e differenziazione."
  ],
  "opportunities": [
    "Riorganizzare l'offerta intorno ai bisogni reali dei clienti.",
    "Creare una gerarchia visiva più autorevole e riconoscibile.",
    "Inserire CTA, prove sociali e tracciamento delle richieste."
  ],
  "services": [
    {
      "title": "Strategia e contenuti",
      "description": "Posizionamento, architettura e testi costruiti intorno alle domande dei clienti."
    },
    {
      "title": "Design e sviluppo",
      "description": "Un'interfaccia distintiva, veloce e realmente ottimizzata per smartphone."
    },
    {
      "title": "Conversione e misura",
      "description": "CTA, tracciamenti e miglioramenti basati su ciò che produce richieste concrete."
    }
  ],
  "cta": {
    "title": "Ha senso approfondire?",
    "description": "Possiamo trasformare questo concept in un progetto completo, definendo insieme priorità, tempi e investimento.",
    "email": "hello@axante.it"
  },
  "verifiedFacts": [],
  "sourceUrls": []
}
